"uid","Status","Title","Slug","Goal","1977 Neighborhood Plan","1995 Needs Assessment","1998 Neighborhood Plan","2007 Bicycle Master Plan","2007 Airport Way Visioning","2008 Duwamish Visioning","Progress","Maptype","Progress Detail","Challenges and barriers","Next Steps","Category","Image_URL","Lat","Long","Location"
"97",,"Redefine land use code to address high-impact uses with the intent of creating specific standards relative to proximity to residential areas.","Redefine land use code to address high-impact uses with the intent of creating specific standards relative to proximity to residential areas.","Redefine land use code to address high-impact uses with the intent of creating specific standards relative to proximity to residential areas.",,,"x",,,,"No Progress","point",,"New Industrial Zoning legislation contradicts this goal",,"Land Use",,"-122.32","47.54","**TBD"
"96",,"Remove the IB zoning designation from the GT Playfield…rezone as residential.","Remove the IB zoning designation from the GT Playfield…rezone as residential.","Remove the IB zoning designation from the GT Playfield…rezone as residential.",,,"x",,,,"No Progress","polygon",,,"Advocate for rezoning as part of the Stakeholder Group of Industrial Lands legislation","Land Use",,"-122.32","47.55","Georgetown Playfield"
"100",,"River area rezone","River area rezone","Rezone an area near the river to allow parks and residential","x",,,,,,"No Progress","polygon",,,,"Land Use",,"-122.32","47.54","**Needs research"
"72",,"River St. & E. Marginal Way","River St. and E. Marginal Way","New pedestrian activated signal at River and Marginal",,,,"x",,,"No Progress","point",,,,"Transportation",,"-122.33","47.54","River St. & E. Marginal Way"
"1",,"Seattle Design District","Seattle Design District","Defining [The Seattle Design District]…physically through signage and gateway entries.",,,"x",,,,"No Progress","polygon",,,"Identify and contact the","Seattle Design District",,"-122.31","47.54","**Needs research"
"56",,"South Lucile","South Lucile","Evaluate spur railroad south of Lucile as a non-motorized corridor","x",,"x","x","x",,"No Progress","** Needs verification","Stalled","Funding and negotiating with the railroad","Contact SDOT to push the project forward; identify funding opportunities","Transportation",,"-122.33","47.55","South Lucile St."
"34",,"Stage for outdoor music","Stage for outdoor music","Stage for outdoor music",,,,,,"x","No Progress","**Needs research",,,,"Parks and Open Space",,"-122.31","47.54",
"99",,"Triangle Rezone","Triangle Rezone","Rezone the ""Triangle"" (Bailey, Corson, Airport) from industrial to mixed use","x","x",,,,,"No Progress","polygon",,,,"Land Use",,"-122.32","47.55","Baily St. & Corson Ave & Airport Way"
"73",,"Vale St. & Corson Ave.","Vale St. and Corson Ave.","New pedestrian activated signal at Vale and Corson",,,,"x",,,"No Progress","point",,,,"Transportation",,"-122.32","47.55","Vale St. & Corson Ave."
"106",,"Warehouse district","Warehouse district","Turn warehouse district into affordable/fixed rate/artist’s/co-op housing and residential area",,,,,,"x","No Progress","Verify – vision data",,,,"Land Use",,"-122.33","47.54","**Needs research"
"20",,"Waste Management","Waste Management",,,,,,,,"No Progress","polygon",,,,"Quality of Life",,"-122.32","47.54","Waste Management"
"82",,"Water Taxis","Water Taxis","Water taxis as public transportation along the river",,,,,,"x","No Progress","Verify – vision data",,,,"Transportation",,"-122.33","47.54",