"#","STATUS","Location ID","Title","Address","ORGANIZATIONS","LAT","LONG","PROJECT_DESCRIPTION","PROJECT_DATE","END_DATE","Id","Source","URL","Slug"
"140",,"165","Seahurst Park North Shoreline Restoration, NS-5",,"{{Unlisted}}","47.4834639416","-122.3606533727",,"2010-01-01T00:00:00","2015-01-01T00:00:00","09-DUW-011","B","http://waconnect.paladinpanoramic.com/project/250/6998","Seahurst Park North Shoreline Restoration, NS-5"
"244",,"166","Seahurst Park South Shoreline Restoration NS-5",,"{{Unlisted}}","47.4834639416","-122.3606533727",,"2003-01-01T00:00:00","2018-12-31T00:00:00","09-UG-004","B","http://waconnect.paladinpanoramic.com/project/250/14857","Seahurst Park South Shoreline Restoration NS-5"
"96",,"167","Seattle City Light - Holdin","1605 SW Holden St","Seattle City Light","47.533667","-122.355184","Southwest Seattle Surplus Property Disposition Study: Seattle City Light has many parcels of surplus properties that are no longer needed for electrical distribution. City Light is participating in a study to produce recommendations for future use. Properties in the Duwamish include: 2100 SW Andover Streek, Seattle, 5601 23rd ave SW, 1605 SW Holden St, 2423 S 132nd St Sea Tac, 8820 9th ave SW",,,"{{unlisted}}","A","n/a","Seattle City Light - Holdin"
"97",,"168","Seattle City Light – 23rd Ave","5601 23rd ave SW","Seattle City Light","47.551894","-122.361778","Southwest Seattle Surplus Property Disposition Study: Seattle City Light has many parcels of surplus properties that are no longer needed for electrical distribution. City Light is participating in a study to produce recommendations for future use. Properties in the Duwamish include: 2100 SW Andover Streek, Seattle, 5601 23rd ave SW, 1605 SW Holden St, 2423 S 132nd St Sea Tac, 8820 9th ave SW",,,"{{unlisted}}","A","n/a","Seattle City Light – 23rd Ave"
"98",,"169","Seattle City Light – 9th Ave","8820 9th ave SW","Seattle City Light","47.52401","-122.346708","Southwest Seattle Surplus Property Disposition Study: Seattle City Light has many parcels of surplus properties that are no longer needed for electrical distribution. City Light is participating in a study to produce recommendations for future use. Properties in the Duwamish include: 2100 SW Andover Streek, Seattle, 5601 23rd ave SW, 1605 SW Holden St, 2423 S 132nd St Sea Tac, 8820 9th ave SW",,,"{{unlisted}}","A","n/a","Seattle City Light – 9th Ave"
"99",,"170","Seattle City Light – Andover","2100 SW Andover Streek","Seattle City Light","47.568369","-122.360131","Southwest Seattle Surplus Property Disposition Study: Seattle City Light has many parcels of surplus properties that are no longer needed for electrical distribution. City Light is participating in a study to produce recommendations for future use. Properties in the Duwamish include: 2100 SW Andover Streek, Seattle, 5601 23rd ave SW, 1605 SW Holden St, 2423 S 132nd St Sea Tac, 8820 9th ave SW",,,"{{unlisted}}","A","n/a","Seattle City Light – Andover"
"100",,"171","Seattle City Light – Sea Tac","2423 S 132nd St Sea Tac","Seattle City Light","47.485113","-122.301089","Southwest Seattle Surplus Property Disposition Study: Seattle City Light has many parcels of surplus properties that are no longer needed for electrical distribution. City Light is participating in a study to produce recommendations for future use. Properties in the Duwamish include: 2100 SW Andover Streek, Seattle, 5601 23rd ave SW, 1605 SW Holden St, 2423 S 132nd St Sea Tac, 8820 9th ave SW",,,"{{unlisted}}","A","n/a","Seattle City Light – Sea Tac"
"101",,"172","Seattle City Light ??North site",,"Seattle City Light","47.60621","-122.332071","""City Light North"" site: Conceptual plans call for creating shallow water transition zone habitat, wetland enhancement, planting of submergent and emergent vegetation, and creation of shallow water transition zone habitat, at river mile 5 on the Duwamish",,,"{{unlisted}}","A","n/a","Seattle City Light ??North site"
"102",,"173","Seattle City Light Parcels",,"Seattle City Light","47.60621","-122.332071","Seattle City Light has developed a comprehensive program to address the needs of wildlife that are affected by their operations. In the Land Management Program, City Light purchases key parcels of land for wildlife habitat. ",,,"{{unlisted}}","A","n/a","Seattle City Light Parcels"
"103",,"174","Seattle City Light South Park",,"Seattle City Light","47.531094","-122.325736","City Light South restoration site. Installed riparian vegetation, large woody debris, and gravel along the Dwamish River (South Park neighborhood).",,,"{{unlisted}}","A","n/a","Seattle City Light South Park"
"104","**dupe??","175","Seattle Seawall Project",,"Port of Seattle","47.60621","-122.332071","Seattle Seawall Project: replacing seawall and removing viaduct. The Seawall Project is replacing the seawall along Seattle's waterfront to protect critical infrastructure and utilities and also take advantage of a once-in-a-lifetime opportunity to enhance the habitat through this area.",,,"{{unlisted}}","A","n/a","Seattle Seawall Project"
"125",,"175","Viaduct Seawall",,"Seattle Dept. of Transportation","47.60621","-122.332071","Seattle Seawall Project: replacing seawall and removing viaduct. The Seawall Project is replacing the seawall along Seattle's waterfront to protect critical infrastructure and utilities and also take advantage of a once-in-a-lifetime opportunity to enhance the habitat through this area.",,,"{{unlisted}}","A","n/a","Viaduct Seawall"
"245",,"176","Seattle Waterfront Shallow Water Bench Habitat Rehabilitation, NS-4",,"{{Unlisted}}","47.5","122.3",,"2010-01-01T00:00:00","2010-12-31T00:00:00","09-UG-005","B","http://waconnect.paladinpanoramic.com/project/250/9063","Seattle Waterfront Shallow Water Bench Habitat Rehabilitation, NS-4"
"246",,"177","Shallow Water Habitat Creation (10 acres) at RM 5.5-4.7, DUW-11",,"{{Unlisted}}","47.5","122.3",,"2008-07-01T00:00:00","2010-08-31T00:00:00","09-WW-001","B","http://waconnect.paladinpanoramic.com/project/250/9047","Shallow Water Habitat Creation (10 acres) at RM 5.5-4.7, DUW-11"
"247",,"178","Shallow Water Habitat Creation (20 acres) at RM 7.0 - 5.5, DUW-7",,"{{Unlisted}}","47.5050511969","-122.2943401307",,"2011-12-15T00:00:00","2013-12-15T00:00:00","0924001","B","http://waconnect.paladinpanoramic.com/project/250/9046","Shallow Water Habitat Creation (20 acres) at RM 7.0 - 5.5, DUW-7"
"248",,"179","Shinglemill Creek Salmon Habitat Enhancement",,"{{Unlisted}}","47.4783502805","-122.4803996081",,"0001-01-01T00:00:00","0001-01-01T00:00:00","Duwamish","B","http://waconnect.paladinpanoramic.com/project/250/16991","Shinglemill Creek Salmon Habitat Enhancement"
"105","??missing, ??multiple","180","Shoreline Habitat",,"WRIA9 Municipalities","47.5","-122.3","Create a narrow off-channel habitat armored with rocks, restore native shoreline vegetation, and build a small parking lot with trail access to the river. 3.5 acres of the bank, .2 acres marsh, .5 acres mudflat, 1000 feet shoreline bank",,,"{{unlisted}}","A","n/a","Shoreline Habitat"
"106","??multiple","181","Shoreline Master plans",,"Futurewise","47.5","-122.3","Working in every county to update Shoreline Master Plans.",,,"{{unlisted}}","A","n/a","Shoreline Master plans"
"107","**check","182","Slip 4",,"Boeing","47.5","-122.3","Slip 4, North Boeing Field and the Georgetown Steam Plant Flume. The first step in cleaning Slip 4 was controlling the ongoing pollution sources. Actions led by the Washington State Department of Ecology (Ecology) and the US Environmental Protection Agency (EPA) have been completed at a number of sites along the slip, and other efforts will continue to ensure that Slip 4 is not recontaminated. With the source control complete and continued monitoring in place, the City of Seattle, partnered with King County, purchased the cleanup area within the slip to convert it to wildlife and fish habitat.","2009-2012",,"{{unlisted}}","A","n/a","Slip 4"
"154",,"182","Slip 4 Restoration, RM 3.3 (Right Bank)",,"{{Unlisted}}","47.5351406588","-122.3204755784",,"2010-01-01T00:00:00","2012-12-31T00:00:00","09-LG-006","B","http://waconnect.paladinpanoramic.com/project/250/17102","Slip 4 Restoration, RM 3.3 (Right Bank)"
"108",,"183","Smith parcel",,"WRIA9 Municipalities","47.5","-122.3","Acquire a .64 acre parcel of land (Smith parcel) situated between publicly owned lands adjacent to the Green River, allowing future project phases to set back a segment of the river levee and restore riverine habitat.",,,"{{unlisted}}","A","n/a","Smith parcel"
"110",,"184","South Park 8th Avenue",,"Port of Seattle","47.525827","-122.322935","South Park 8th Avenue Public - restored shoreline and public access",,,"{{unlisted}}","A","n/a","South Park 8th Avenue"
"249",,"185","South Park Bank Restoration and Shallow Water Habitat Creation DUW-12",,"{{Unlisted}}","47.5","122.3",,"0001-01-01T00:00:00","0001-01-01T00:00:00","Duwamish Shallow Water","B","http://waconnect.paladinpanoramic.com/project/250/9059","South Park Bank Restoration and Shallow Water Habitat Creation DUW-12"
"111",,"186","South Riverside Street End",,"Port of Seattle","47.60621","-122.332071","South Riverside Street End - restored shoreline",,,"{{unlisted}}","A","n/a","South Riverside Street End"
"192",,"187","Springbrook - Lower – Reach Rehabilitation, LG-19",,"{{Unlisted}}","47.5","122.3",,"2012-01-01T00:00:00","2013-12-31T00:00:00","09-MG-014","B","http://waconnect.paladinpanoramic.com/project/250/8630","Springbrook - Lower – Reach Rehabilitation, LG-19"
"112",,"188","Springbrook Creek",,"WA Dept. of Transportation","47.5","-122.3","Springbrook Creek Mitigation Bank is composed of five separate units. The purpose of this bank is to provide compensation for unavoidable impacts to wetlands and other aquatic resources caused by WSDOT. ",,,"{{unlisted}}","A","n/a","Springbrook Creek"
"113","**check","189","Superfund cleanup",,"EPA, WA Dept. of Ecology","47.5","-122.3","Duwamish Superfund Cleanup - Pollutants of concern: PCBs and carcinogens, phthalates, oil and hydrocarbons, heavy metals, poisons, pesticides and arsenic, stormwater runoff, raw sewage. The US EPA classified the Duwamish as a superfund pollution site - the cleanup is required by EPA.",,,"{{unlisted}}","A","n/a","Superfund cleanup"
"114",,"190","Sweeney Creek",,"WRIA9 Municipalities","47.5","-122.3","Replace failed culvert at Sweeney Creek for fish passage.",,,"{{unlisted}}","A","n/a","Sweeney Creek"
"115",,"191","Terminal 105",,"Port of Seattle","47.567829","-122.350815","Terminal 105 Public Access Site. Created or restored marsh, installed riparian vegetation, removed fill.",,,"{{unlisted}}","A","n/a","Terminal 105"
"116",,"192","Terminal 107",,"Port of Seattle","47.63357","-122.379439","Terminal 107. Park completed in 2000, including shoreline access, pathways, and habitat restoration area. In order to create this special park, businesses and container cargo facilities were relocated to Terminals 5 and 18.",,,"{{unlisted}}","A","n/a","Terminal 107"
"117",,"193","Terminal 108",,"Port of Seattle","47.63357","-122.379439","Diagonal Avenue South, Terminal 108. Created marsh, installed riparian vegetation.",,,"{{unlisted}}","A","n/a","Terminal 108"
"118",,"194","Terminal 117",,"Port of Seattle","47.63357","-122.379439","Terminal 117. T-117 uplands soil cleanup construction began on schedule in June 2013. During this construction, steel sheet piling is used to isolate contaminated soil and water from the river. PCB contaminated soil is excavated and hauled offsite to a licensed waste landfill. Several unanticipated underground storage tanks and barrels containing waste oil and other remains have been uncovered on-site; but there have been no impacts or threats to the community from the discovery and handling of these materials. Air quality and noise are monitored daily during all construction activities, and artificial light is measured during any night work. Air quality levels have consistently been below the limits set by the project, which are below Federal and State guidelines. Sediment cleanup will be performed during the open fish window (December 2013 – February 2014) when in-water construction is less likely to harm migrating or spawning fish, or interfere with tribal fishing.",,,"{{unlisted}}","A","n/a","Terminal 117"
"119",,"195","Teufel Property",,"King County DNR & Parks and subdivision WLRD","47.5","-122.3","Teufel Property - flood risk reduction and salmon habitat restoration over the entire remaining area (where they didn’t plant or place large wood), with preliminary project concepts including off-channel habitat for salmon, riparian vegetation, and fill removal",,,"{{unlisted}}","A","n/a","Teufel Property"
"120",,"195","Teufel Property",,"King County DNR & Parks and subdivision WLRD","47.5","-122.3","Teufel Property - Mitigation planting and wood placement, within 200' shoreline zone, to provide riparian vegetation, shade, and instream habitat",,,"{{unlisted}}","A","n/a","Teufel Property"
"251",,"196","Turley Levee Setback at RM 37, MG-11",,"{{Unlisted}}","47.5","122.3",,"2005-01-01T00:00:00","2012-01-01T00:00:00","Nearshore Protection","B","http://waconnect.paladinpanoramic.com/project/250/9051","Turley Levee Setback at RM 37, MG-11"
"121",,"197","Turning Basin No. 3",,"King County Wastewater Treatment Division","47.5","-122.3","Turning Basin No. 3 restoration project: An old building, dock, and grounded barges were removed. Fill material was removed to push back the shoreline. Marsh and riparian vegetation were planted.",,,"{{unlisted}}","A","n/a","Turning Basin No. 3"
"122",,"198","Turning basin site owned by Seattle City Light, adjacent to Boeing Company office complex",,"Seattle City Light","47.60621","-122.332071","Turning basin site owned by Seattle City Light, adjacent to Boeing Company office complex",,,"{{unlisted}}","A","n/a","Turning basin site owned by Seattle City Light, adjacent to Boeing Company office complex"
"123",,"199","Upper Green River",,"Forterra","47.5","-122.3","8,035 acre easment over commercial forestland in the Upper Green River watershed.",,,"{{unlisted}}","A","n/a","Upper Green River"
"124",,"200","Urban Forest – Forterra",,"Forterra","47.5","-122.3","28 acres of urban forest and riparian land with the potential of becoming an urban park.",,,"{{unlisted}}","A","n/a","Urban Forest – Forterra"
"128",,"201","WRIA 9 Shoreline",,"King County DNR & Parks and subdivision WLRD","47.5","-122.3","WRIA 9 Marine Shoreline Monitoring and Compliance Pilot Project: King County will survey 90 miles of marine shoreline in WRIA 9 to collect shoreline use data that will be cross-checked with baseline data. Any new, unpermitted, anthropogenic shoreline modifications will be addressed to ensure compliance with existing regulations.",,,"{{unlisted}}","A","n/a","WRIA 9 Shoreline"