"#","STATUS","Location ID","Title","Address","ORGANIZATIONS","LAT","LONG","PROJECT_DESCRIPTION","PROJECT_DATE","END_DATE","Id","Source","URL","Slug"
"72",,"119","Miller/Walker Creek",,"WRIA9 Municipalities","47.5","-122.3","Grants to seven projects including pre-project aquatic monitoring of Elliott Bay shoreline restoration at Olympic Sculpture Park, farm buffer restoration, John Beal citizen patrol of the Duwamish, citizen monitoring of lakes in Maple Valley, purchase of property on Hamm Creek, design of Kent park, natural yard care, agriculture land restoration, preparation to purchase Carosino property on the Duwamish, restoration of Miller/Walker Creek, and monitoring of Lake Sawyer",,,"{{unlisted}}","A","n/a","Miller/Walker Creek"
"126",,"119","Walker Creek",,"WRIA9 Municipalities","47.5","-122.3","The goal of this project was to rehabilitate and restore a degraded portion of middle Walker Creek within the City of Normandy Park. The project site included a portion of Walker Preserve, a local public park, and a neighboring private property site. The site was cleared of invasive vegetation using mechanical equipment. The banks of the stream were regraded and large woody debris and spawning gravel were installed. Jute matting and other erosion control measures were constructed and the site was revegetated with native plants and trees.",,,"{{unlisted}}","A","n/a","Walker Creek"
"127",,"119","Walker Creek Headwaters",,"King Conservation District","47.5","-122.3","Acquire 21 acres of wetlands (Walker Creek Headwaters) to protect them from development.",,,"{{unlisted}}","A","n/a","Walker Creek Headwaters"
"250",,"119","Stewards of the Cove - Miller and Walker Creek Restoration",,"{{Unlisted}}","47.4437285607","-122.3571360082",,"2007-01-01T00:00:00","2017-01-01T00:00:00","Lower Green","B","http://waconnect.paladinpanoramic.com/project/250/16977","Stewards of the Cove - Miller and Walker Creek Restoration"
"207",,"119","Miller and Walker Creeks Noxious Weed Control Project",,"{{Unlisted}}","47.446812172","-122.3494434357",,"2005-01-01T00:00:00","2011-12-31T00:00:00","09-MG-18C","B","http://waconnect.paladinpanoramic.com/project/250/16957","Miller and Walker Creeks Noxious Weed Control Project"
"205",,"119","Middle Walker Creek and Walker Preserve Stream Habitat Restoration",,"{{Unlisted}}","47.4481182638","-122.3252820969",,"1999-12-21T00:00:00","2000-09-14T00:00:00","09-MG-028","B","http://waconnect.paladinpanoramic.com/project/250/16954","Middle Walker Creek and Walker Preserve Stream Habitat Restoration"
"69",,"120","Mill Creek",,"WRIA9 Municipalities","47.5","-122.3","Design and permitting for four restoration projects at Mill Creek to improve water quality and increase species diversity, including more sustainable habitat to support species of concern including great blue heron, bald eagle and others",,,"{{unlisted}}","A","n/a","Mill Creek"
"70",,"120","Mill Creek ",,"WRIA9 Municipalities","47.5","-122.3","Replace an existing roadside ditch at Springbrook Creek with a natural meandering stream channel with spawning, rearing and storm refuge habitat for migrating salmon.",,,"{{unlisted}}","A","n/a","Mill Creek "
"71",,"120","Mill Creek Confluence",,"WRIA9 Municipalities","47.5","-122.3","Mill Creek Confluence/Green River Design. A preliminary design project was previously funded by SRFB for Feasibility and 30% Design, project # 05-1519, and was completed in February 2009. This project request is for Final Design and permitting of the Mill Creek Confluence/Green River Restoration Project. The project will create a side channel off the Green River east of the confluence of Mill Creek. A bench is proposed at the mouth of the side channel to provide low-water salmonid habitat. The final design will include the removal of invasive plants, native riparian planting plan including more diversity and density. New off-channel habitat was constructed, log structures designed to maximize salmon habitat, invasive vegetation removed, improved riparian areas to increase diversity, density, and shading.",,,"{{unlisted}}","A","n/a","Mill Creek Confluence"
"189",,"120","Mill Creek - Lower – Floodplain Wetland Off-Channel Habitat Rehab, LG-7 (Leber)",,"{{Unlisted}}","47.3686182591","-122.2459959984",,"2017-01-01T00:00:00","2020-01-01T00:00:00","09-MG-011","B","http://waconnect.paladinpanoramic.com/project/250/8568","Mill Creek - Lower – Floodplain Wetland Off-Channel Habitat Rehab, LG-7 (Leber)"
"188",,"120","Mill Creek  - Lower – Future Project, LG-7",,"{{Unlisted}}","47.5","122.3",,"2012-01-01T00:00:00","2013-01-01T00:00:00","09-MG-010","B","http://waconnect.paladinpanoramic.com/project/250/8628","Mill Creek  - Lower – Future Project, LG-7"
"206",,"120","Mill Creek Physical/Habitat Survey",,"{{Unlisted}}","47.5","122.3",,"1999-12-21T00:00:00","2001-04-20T00:00:00","09-MG-029","B","http://waconnect.paladinpanoramic.com/project/250/13412","Mill Creek Physical/Habitat Survey"
"243",,"120","Schuler Brothers Reach Rehabilitation - Mill Creek, LG-8",,"{{Unlisted}}","47.5","122.3",,"2005-01-01T00:00:00","2005-12-31T00:00:00","09-UG-003","B","http://waconnect.paladinpanoramic.com/project/250/9056","Schuler Brothers Reach Rehabilitation - Mill Creek, LG-8"
"73",,"121","Mullen Slough",,"King Conservation District","47.5","-122.3","Mullen Slough Restoration: purchase and restore Mullen Slough to improve habitat for fish",,,"{{unlisted}}","A","n/a","Mullen Slough"
"190",,"122","Mullen Slough - Lower - LG-7",,"{{Unlisted}}","47.5","122.3",,"2010-01-01T00:00:00","2010-12-31T00:00:00","09-MG-012","B","http://waconnect.paladinpanoramic.com/project/250/8570","Mullen Slough - Lower - LG-7"
"208",,"123","Myrtle Edwards Park Habitat Rehabilitation, NS-2",,"{{Unlisted}}","47.6257254382","-122.3725096617",,"2009-03-16T00:00:00","2009-09-30T00:00:00","09-MSFEG-8820100","B","http://waconnect.paladinpanoramic.com/project/250/8667","Myrtle Edwards Park Habitat Rehabilitation, NS-2"
"209",,"124","NE Auburn Creek Rehabilitation LG-5",,"{{Unlisted}}","47.5","122.3",,"2010-12-01T00:00:00","2015-12-31T00:00:00","09-NS-002","B","http://waconnect.paladinpanoramic.com/project/250/8697","NE Auburn Creek Rehabilitation LG-5"
"210",,"125","Nearshore and estuarine restoration through oyster introduction",,"{{Unlisted}}","47.3925017848","-122.432664904",,"2006-01-01T00:00:00","2007-12-31T00:00:00","09-NS-003","B","http://waconnect.paladinpanoramic.com/project/250/16992","Nearshore and estuarine restoration through oyster introduction"
"211",,"126","Nearshore Protection Tier 2",,"{{Unlisted}}","47.5","122.3",,"2010-01-01T00:00:00","2011-12-31T00:00:00","09-NS-003M","B","http://waconnect.paladinpanoramic.com/project/250/13566","Nearshore Protection Tier 2"
"212",,"127","Nearshore Tier 1",,"{{Unlisted}}","47.5","122.3",,"2010-01-01T00:00:00","2015-01-01T00:00:00","09-NS-004","B","http://waconnect.paladinpanoramic.com/project/250/10250","Nearshore Tier 1"
"213",,"128","Needle Creek Slope Stabilization",,"{{Unlisted}}","47.4673634684","-122.4669456474",,"2004-01-01T00:00:00","2005-12-31T00:00:00","09-NS-005A","B","http://waconnect.paladinpanoramic.com/project/250/16980","Needle Creek Slope Stabilization"
"75","??combineorgs","129","Newaukum Creek",,"King County DNR & Parks and subdivision WLRD","47.5","-122.3","Newaukum Creek Mouth Restoration Project - This project has two components: 1) Placing large woody debris and planting native trees along the lower 4.3 miles of the creek, and 2) reconfiguring the lower 1,800 feet of the creek near the mouth. ",,,"{{unlisted}}","A","n/a","Newaukum Creek"
"76","??combineorgs","129","Newaukum Creek",,"King Conservation District","47.5","-122.3","Newaukum Creek Passage Barrier Assessment and Replacement Project: Conduct GIS analysis of basin to assess likely passage barriers, conduct field surveys, and design, permit, and remove the top-ranked barrier that is found.",,,"{{unlisted}}","A","n/a","Newaukum Creek"
"77","??combineorgs","129","Newaukum Creek",,"WA Dept. of Ecology","47.5","-122.3","To address the water quality issues, in 2006 Ecology initiated water quality improvement projects for temperature and dissolved oxygen in the Green River and Newaukum Creek. Ecology, King County, and others cooperated in a summer field study to collect data for the temperature and dissolved oxygen TMDL studies. As part of the TMDL study, Ecology identified the pollution problems and specified how much pollution needs to be reduced to achieve clean water. As a follow-up to the TMDL study, Ecology works with the local community to prepare a water quality implementation plan (WQIP) that details the specific actions needed to improve water quality in the basin. The plan describes management roles, activities, and schedules for partners.",,,"{{unlisted}}","A","n/a","Newaukum Creek"
"214",,"129","Newaukum Creek Mouth Restoration Between RM 0.0 and 4.3, MG-8",,"{{Unlisted}}","47.2814000276","-122.0652794838",,"2008-01-01T00:00:00","2014-06-30T00:00:00","09-NS-005B","B","http://waconnect.paladinpanoramic.com/project/250/9050","Newaukum Creek Mouth Restoration Between RM 0.0 and 4.3, MG-8"
"215",,"130","Newaukum Creek Restoration, MG-6",,"{{Unlisted}}","47.2142452362","-122.0101865595",,"2014-01-01T00:00:00","2015-12-31T00:00:00","09-NS-007","B","http://waconnect.paladinpanoramic.com/project/250/16975","Newaukum Creek Restoration, MG-6"
"78",,"131","Norfolk CSO",,"King County Wastewater Treatment Division","47.5","-122.3","Norfolk CSO sediment remediation project: dredging contaminated sediment, backfilling the dredged area with clean sediment. Contaminated sediments were removed from the site by mechanical dredge and dewatered onshore in a contaminent area. Monitoring over five years was done to evaluate possible recontamination of the backfill sediment as a result of continuing CSO discharges.",,,"{{unlisted}}","A","n/a","Norfolk CSO"
"79","**check","132","North Boeing Field",,"Boeing","47.5","-122.3",,"2009-2012",,"{{unlisted}}","A","n/a","North Boeing Field"
"80",,"133","North Wind's Weir",,"King County DNR & Parks and subdivision WLRD","47.5","-122.3","North Wind's Weir Intertidal Restoration #1. King County will use this grant to excavate 2 acres of off-channel, shallow water habitat in the Duwamish River. Work will include improving river bank vegetation, expanding shallow habitats and marshes and enlarging the Duwamish River estuarine transition zone habitat. King County acquired the property in 2001, removed 4,500 cubic yards of contaminated soil in 2004, completed design in 2006 and plans to construct the restoration project in 2008.",,,"{{unlisted}}","A","n/a","North Wind's Weir"
"81",,"133","North Winds Weir",,"King County Wastewater Treatment Division","47.5","-122.3","North Winds Weir Restoration Project: one-acre basin created to provide off-channel habitat for out-migrating salmonids. Emergent and riparian vegetation has been planted and work continues.",,,"{{unlisted}}","A","n/a","North Winds Weir"
"217",,"133","North Wind's Weir Monitoring DUW-10M",,"{{Unlisted}}","47.5","122.3",,"2010-01-01T00:00:00","2013-12-31T00:00:00","09-NS-009","B","http://waconnect.paladinpanoramic.com/project/250/17392","North Wind's Weir Monitoring DUW-10M"
"216",,"133","North Wind's Weir Acquisition DUW-10A",,"{{Unlisted}}","47.5038364035","-122.2960533666",,"2010-01-01T00:00:00","2013-12-31T00:00:00","09-NS-008","B","http://waconnect.paladinpanoramic.com/project/250/17361","North Wind's Weir Acquisition DUW-10A"
"218",,"134","North Wind's Weir Shallow Water Habitat Rehabilitation DUW-10",,"{{Unlisted}}","47.5036","-122.2958",,"2006-01-01T00:00:00","2008-03-01T00:00:00","09-NS-010","B","http://waconnect.paladinpanoramic.com/project/250/9045","North Wind's Weir Shallow Water Habitat Rehabilitation DUW-10"
"219",,"135","O'Grady Stream Restoration",,"{{Unlisted}}","47.5","122.3",,"2005-01-01T00:00:00","2014-01-01T00:00:00","09-NS-011A","B","http://waconnect.paladinpanoramic.com/project/250/17357","O'Grady Stream Restoration"
"220",,"136","Off Channel Habitat Rehabilitation Between RM 12.65 and 12.5, LG-15",,"{{Unlisted}}","47.5","122.3",,"2010-06-01T00:00:00","2015-12-31T00:00:00","09-NS-011B","B","http://waconnect.paladinpanoramic.com/project/250/9058","Off Channel Habitat Rehabilitation Between RM 12.65 and 12.5, LG-15"
"82",,"137","Olson Creek",,"WRIA9 Municipalities","47.5","-122.3","Olson Creek Restoration - design fish passage improvements for roadway culvert",,,"{{unlisted}}","A","n/a","Olson Creek"
"221",,"137","Olson Creek Restoration Project Details LG-2",,"{{Unlisted}}","47.5676640415","-122.3344912661",,"2012-01-01T00:00:00","2015-01-01T00:00:00","09-NS-012","B","http://waconnect.paladinpanoramic.com/project/250/7563","Olson Creek Restoration Project Details LG-2"
"83","**Dupe??","138","Olympic Sculpture Park – 2",,"Seattle Parks","47.60621","-122.332071","Olympic Sculpture Park - constructed in 2007 on Elliott Bay. Restoration was done along the shoreline, and a 'brown field' turned into a 'green field.' Constructed embayment in the nearshore to provide salmon habitat. Monitoring assessed the ecological performance of habitat modifications.",,,"{{unlisted}}","A","n/a","Olympic Sculpture Park – 2"
"223",,"138","Olympic Sculpture Park Monitoring",,"{{Unlisted}}","47.5","122.3",,"2010-01-01T00:00:00","2015-01-01T00:00:00","09-NS-014","B","http://waconnect.paladinpanoramic.com/project/250/17391","Olympic Sculpture Park Monitoring"
"222",,"139","Olympic Sculpture Park Habitat Rehabilitation, NS-3",,"{{Unlisted}}","47.6162037571","-122.3575231394",,"2010-01-01T00:00:00","2010-12-31T00:00:00","09-NS-013","B","http://waconnect.paladinpanoramic.com/project/250/9062","Olympic Sculpture Park Habitat Rehabilitation, NS-3"
"84",,"140","Pautzke Levee",,"King County DNR & Parks and subdivision WLRD","47.5","-122.3","Pautzke Restoration. A grant from RCO allowed WLRD to design and get permits for project to improve salmon habitat. In the next stage, two segments of the Pautzke Levee removed along the Green River. ",,,"{{unlisted}}","A","n/a","Pautzke Levee"
"224",,"140","Pautzke Levee Removal and Setback, MG-18",,"{{Unlisted}}","47.3053698474","-122.1946692467",,"2014-01-01T00:00:00","2015-06-30T00:00:00","09-NS-015","B","http://waconnect.paladinpanoramic.com/project/250/9953","Pautzke Levee Removal and Setback, MG-18"
"85",,"141","Pigeon Point",,"The Nature Consortium","47.570654","-122.359294","Pigeon Point Restoration: planting native vegetation, remove invasive species",,,"{{unlisted}}","A","n/a","Pigeon Point"
"226",,"142","Piner Point Bulkhead Removal NS-17",,"{{Unlisted}}","47.3455","-122.4536",,"2010-01-01T00:00:00","2010-12-31T00:00:00","09-NS-016","B","http://waconnect.paladinpanoramic.com/project/250/15796","Piner Point Bulkhead Removal NS-17"
"225",,"142","Piner Point Acquisition on Maury Island NS-17",,"{{Unlisted}}","47.5","122.3",,"2015-02-01T00:00:00","2018-06-29T00:00:00","09-NS-015B","B","http://waconnect.paladinpanoramic.com/project/250/15795","Piner Point Acquisition on Maury Island NS-17"
"227",,"143","Pocket Estuary Restoration at Mouth of Unnamed Creek in Normandy Park, NS-12",,"{{Unlisted}}","47.5","122.3",,"2005-01-01T00:00:00","2018-12-31T00:00:00","09-NS-017A","B","http://waconnect.paladinpanoramic.com/project/250/9064","Pocket Estuary Restoration at Mouth of Unnamed Creek in Normandy Park, NS-12"
"228",,"144","Point Heyer Driftcell",,"{{Unlisted}}","47.4360847252","-122.43718862",,"2003-01-01T00:00:00","2010-12-01T00:00:00","09-NS-017D","B","http://waconnect.paladinpanoramic.com/project/250/10252","Point Heyer Driftcell"
"86",,"145","Porter Levee",,"King County DNR & Parks and subdivision WLRD","47.5","-122.3","Porter Levee Restoration/Setback. In the planning stage, King County will: 1) develop a surveyed site plan; 2) perform a wetland study; 3) perform a geotechnical study; 4) perform a hydrologic analysis; 5) prepare preliminary design plan drawings; 6) prepare a design report and 7) prepare an engineering cost estimate for construction of the project. Levee setback will relocate the 1,400 lineal-foot Porter training leveeto reconnect the Green River with 52 acres of associated floodplain. Large engineered log structures will be placed as well as native riparian trees and shrubs. A setback levee will be constructed adjacent to Green Valley Road to protect the road and other infrastructure.",,,"{{unlisted}}","A","n/a","Porter Levee"
"229",,"145","Porter Levee Section Removal",,"{{Unlisted}}","47.2939361989","-122.1686535057",,"2003-01-01T00:00:00","2010-09-30T00:00:00","09-NS-017E","B","http://waconnect.paladinpanoramic.com/project/250/17360","Porter Levee Section Removal"
"230",,"145","Porter Levee Setback and Floodplain Reconnection, MG-15",,"{{Unlisted}}","47.5","122.3",,"2005-01-01T00:00:00","2021-12-01T00:00:00","09-NS-017F","B","http://waconnect.paladinpanoramic.com/project/250/9052","Porter Levee Setback and Floodplain Reconnection, MG-15"
"231",,"145","Porter Levee Setback, Floodplain Reconnection",,"{{Unlisted}}","47.5","122.3",,"2010-01-01T00:00:00","2015-12-29T00:00:00","09-NS-020","B","http://waconnect.paladinpanoramic.com/project/250/9054","Porter Levee Setback, Floodplain Reconnection"
"87","**notduwamish","146","Pt. Heyer Drift Cell",,"King County DNR & Parks and subdivision WLRD","47.5","-122.3","Pt. Heyer Drift Cell Preservation: The overal goal ofthe Pt Heyer Dift Cell Preservation project is to presrve roughly 10,50 feet ofthe Pt. Heyer Dift Cell (PHDC) shoreline on the ast side of Vashon Island. The drift cell begins at the feeder bluffs atVashon Landing and terminates 2. miles to the south at he Pt. Heyer barrier lagoon. This grant will fund two target parcels located in the north reach of the drift cell preserve the sediment supply to the largest (and last) remaing barrier lagon in King County. Acquiston of these parcels adds 5 acres of coniferous forest uplands, 4.7 acres of marine forested feeder bluff, and 48 feet of shoreline to the inventory of the Pt. Heyer Natural Area. Eelgrass beds are present in the entire length in the interidal zone. The Pt. Heyer barrier lagoon and its over 5-acre salt marsh are important habitat features for juvenile salmonids. A cabin is present on the site but follwing removal of the cabin, no major restoration is neccessary. The cabin removal has already been scheduled and funded. Ongoing stewardship mainteance, including invasive specise and litter monitorng and removal, will continue indefintely. ",,,"{{unlisted}}","A","n/a","Pt. Heyer Drift Cell"
"88",,"147","Puget Creek Estuary",,"Port of Seattle","47.60621","-122.332071","Puget Creek Estuary. Restored shoreline, created or restored marsh, installed riparian vegetation, removed fill.",,,"{{unlisted}}","A","n/a","Puget Creek Estuary"
"232",,"148","Puget Sound Rain Gardens - Longfellow Creek",,"{{Unlisted}}","47.5415279489","-122.3600863977",,"2010-01-01T00:00:00","2013-12-31T00:00:00","09-NS-021","B","http://waconnect.paladinpanoramic.com/project/250/16972","Puget Sound Rain Gardens - Longfellow Creek"
"233",,"149","Ray Creek Restoration at RM 34.2, MG-16",,"{{Unlisted}}","47.5","122.3",,"2010-04-01T00:00:00","2011-12-31T00:00:00","09-NS-024","B","http://waconnect.paladinpanoramic.com/project/250/9053","Ray Creek Restoration at RM 34.2, MG-16"
"89",,"150","Reddington Levee",,"King County DNR & Parks and subdivision WLRD","47.5","-122.3","In 2013, King County set the Reddington Levee back along the left (west) bank of the Green River through a portion of the City of Auburn. The work consisted of removing existing rock armor and levee fill materials, demolishing existing structures, utility construction and relocation, constructing a setback levee and access road, rock barbs, and engineered log jams, and restoring the site with native trees and shrubs. The 2013 project included approximately 4,800 linear feet of setback levee. The southern end of the project included removing existing rock armoring and the existing levee prism that is currently sitting along the river’s edge. A construction and maintenance access road now connects the north end of the levee to R Street.",,,"{{unlisted}}","A","n/a","Reddington Levee"
"109",,"151","Soos Creek",,"WA Dept. of Ecology","47.5","-122.3","In 2006 Ecology initiated a water quality improvement project for temperature and dissolved oxygen in the Soos Creek watershed. In 2007 Ecology, King County, and others collected data for the temperature and dissolved oxygen TMDL study. In 2011 partners Environmental Protection Agency (EPA), EPA contractor Tetra Tech, Muckleshoot Indian Tribe, and Ecology initiated a similar effort for the Soos Creek System, including a new Soos Creek TMDL initiative for fecal coliform bacteria and aquatic habitat. Following the TMDL study, Ecology works with the local community to prepare an implementation plan that details the specific actions needed to improve water quality in the basin.",,,"{{unlisted}}","A","n/a","Soos Creek"
"234",,"151","Restoration along Little Soos and Winter Creeks",,"{{Unlisted}}","47.3804447698","-122.1025759639",,"2004-10-01T00:00:00","2009-06-30T00:00:00","09-NS-025","B","http://waconnect.paladinpanoramic.com/project/250/16988","Restoration along Little Soos and Winter Creeks"
"191",,"152","Soos Creek - Lower – Channel Rehabilitation Between Creek Miles 0.0 and 0.9, MG-21",,"{{Unlisted}}","47.304264024","-122.1727181046",,"2012-01-01T00:00:00","2013-01-01T00:00:00","09-MG-013","B","http://waconnect.paladinpanoramic.com/project/250/17099","Soos Creek - Lower – Channel Rehabilitation Between Creek Miles 0.0 and 0.9, MG-21"
"60",,"153","Soos Creek – Lower",,"Middle Green River Coalition","47.5","-122.3","Remove invasive blackberry at the Lower Soos area without using pesticides or herbicides. ",,,"{{unlisted}}","A","n/a","Soos Creek – Lower"
"235",,"154","Riverside Estates Side Channel Rehabilitation at RM 28.8, LG-1",,"{{Unlisted}}","47.5","122.3",,"2008-07-01T00:00:00","2009-12-31T00:00:00","09-NS-026","B","http://waconnect.paladinpanoramic.com/project/250/9055","Riverside Estates Side Channel Rehabilitation at RM 28.8, LG-1"
"90",,"155","Riverton Creek",,"WRIA9 Municipalities","47.5","-122.3","Riverton Creek Flapgate Removal and Restoration. Tukwila conducted a feasibility analysis and design to determine whether twin flap gates can be removed to connect Riverton Creek and the Duwamish River.",,,"{{unlisted}}","A","n/a","Riverton Creek"
"236",,"155","Riverton Creek Habitat Rehab. Fish Project  DUW-8",,"{{Unlisted}}","47.4998351011","-122.294383049",,"2004-10-01T00:00:00","2008-04-30T00:00:00","09-NS-027","B","http://waconnect.paladinpanoramic.com/project/250/9952","Riverton Creek Habitat Rehab. Fish Project  DUW-8"
"91",,"156","Riverview Park",,"WRIA9 Municipalities","47.5","-122.3","Riverview Park Ecosystem Restoration. Improvements include the placement of large woody debris, spawning gravel, and riparian plantings (a maintenance bridge over the channel will be separated from SRFB funds).",,,"{{unlisted}}","A","n/a","Riverview Park"
"237",,"156","Riverview Park Project, LG-7",,"{{Unlisted}}","47.3717863165","-122.2462427616",,"2005-06-11T00:00:00","2009-03-04T00:00:00","09-NS-028","B","http://waconnect.paladinpanoramic.com/project/250/9954","Riverview Park Project, LG-7"
"238",,"157","Riverview Plaza Off-Channel Habitat Rehabilitation, RM13 (Left Bank), LG-21",,"{{Unlisted}}","47.4594604018","-122.2470799729",,"2010-11-01T00:00:00","2014-07-31T00:00:00","09-NS-029","B","http://waconnect.paladinpanoramic.com/project/250/17101","Riverview Plaza Off-Channel Habitat Rehabilitation, RM13 (Left Bank), LG-21"
"92",,"159","Route 509 & 99 Intersection",,"WA Dept. of Transportation","47.53798","-122.333504","Mudlfat and marsh creation/restoration on the Duwamish waterway in Seattle, at the 509 and 99 intersection., about 47.537980, -122.333504. ",,,"{{unlisted}}","A","n/a","Route 509 & 99 Intersection"
"239",,"159","Rosso Nursery Off-Channel Rehabilitation Riparian Project, LG-9",,"{{Unlisted}}","47.5","122.3",,"2004-01-01T00:00:00","2009-09-30T00:00:00","09-NS-032","B","http://waconnect.paladinpanoramic.com/project/250/9057","Rosso Nursery Off-Channel Rehabilitation Riparian Project, LG-9"
"240",,"160","Salmon-Safe Consumer Education Campaign",,"{{Unlisted}}","47.5","122.3",,"2007-07-01T00:00:00","2008-07-01T00:00:00","09-NS-033","B","http://waconnect.paladinpanoramic.com/project/250/16987","Salmon-Safe Consumer Education Campaign"
"241",,"161","Salmon-Safe Puget Sound: WRIA 9",,"{{Unlisted}}","47.2161668498","-122.2252780526",,"2007-05-01T00:00:00","2011-12-31T00:00:00","09-NS-034","B","http://waconnect.paladinpanoramic.com/project/250/16942","Salmon-Safe Puget Sound: WRIA 9"
"242",,"162","Sandy Beach Fill and Derelict Pier Removal, NS-21",,"{{Unlisted}}","47.5","122.3",,"2005-01-01T00:00:00","2007-12-31T00:00:00","09-UG-002","B","http://waconnect.paladinpanoramic.com/project/250/7567","Sandy Beach Fill and Derelict Pier Removal, NS-21"
"93",,"163","Santilli-Green River Tributary R11",,"WA Dept. of Natural Resources","47.5","-122.3","Santilli-Green River Tributary R11. This barrier culvert is on a tributary to the Green River in King county. Correction of this barrier would improve access to 0.04 miles of habitat for coho and SR cutthroat trout.",,,"{{unlisted}}","A","n/a","Santilli-Green River Tributary R11"
"94",,"164","Sawmill Creek",,"Forterra","47.5","-122.3","302.0 acres protected at Sawmill Creek, a tributary of the Green River. Property designated as a “natural zone” requiring no timber harvesting or road building, left alone to maintain water quality and habitat value",,,"{{unlisted}}","A","n/a","Sawmill Creek"
"95",,"165","Seahurst Park",,"WRIA9 Municipalities","47.5","-122.3","Removal of the north seawall at Seahurst Park in order to restore shorline habitat",,,"{{unlisted}}","A","n/a","Seahurst Park"
